{
 "backend": "basic_simulator → iones (referencia Aria)",
 "total_qubits": 2,
 "initial_fidelity": 99.5,
 "steps": [
  {
   "step": 1,
   "operation": "virtual_z",
   "targets": [
    0
   ],
   "cumulative_fidelity": 99.5,
   "states": [
    [
     0.0,
     0.0,
     1.0
    ],
    [
     0.0,
     0.0,
     1.0
    ]
   ],
   "vibration": [
    0.0,
    0.0
   ],
   "cumulative_cost": 0.0,
   "probabilities": [
    [
     1.0,
     0.0
    ],
    [
     1.0,
     0.0
    ]
   ],
   "virtual_z": [
    3.141593,
    0.0
   ],
   "inactivity": [
    0,
    0
   ],
   "fidelities": [
    100.0,
    100.0
   ]
  },
  {
   "step": 2,
   "operation": "gpi2",
   "targets": [
    0
   ],
   "phases": [
    1.570796
   ],
   "cumulative_fidelity": 99.470152,
   "states": [
    [
     1.0,
     0.0,
     0.0
    ],
    [
     0.0,
     0.0,
     1.0
    ]
   ],
   "vibration": [
    0.0,
    0.0
   ],
   "cumulative_cost": 0.0003,
   "probabilities": [
    [
     0.5,
     0.5
    ],
    [
     1.0,
     0.0
    ]
   ],
   "virtual_z": [
    3.141593,
    0.0
   ],
   "inactivity": [
    0,
    1
   ],
   "fidelities": [
    99.98,
    99.99
   ]
  },
  {
   "step": 3,
   "operation": "gpi2",
   "targets": [
    0
   ],
   "phases": [
    1.570796
   ],
   "cumulative_fidelity": 99.440313,
   "states": [
    [
     0.0,
     0.0,
     -1.0
    ],
    [
     0.0,
     0.0,
     1.0
    ]
   ],
   "vibration": [
    0.0,
    0.0
   ],
   "cumulative_cost": 0.0006,
   "probabilities": [
    [
     0.0,
     1.0
    ],
    [
     1.0,
     0.0
    ]
   ],
   "virtual_z": [
    3.141593,
    0.0
   ],
   "inactivity": [
    0,
    2
   ],
   "fidelities": [
    99.960004,
    99.980001
   ]
  },
  {
   "step": 4,
   "operation": "ms",
   "targets": [
    0,
    1
   ],
   "phases": [
    0.0,
    0.0
   ],
   "angle": 0.25,
   "cumulative_fidelity": 98.943111,
   "states": [
    [
     0.0,
     0.0,
     0.0
    ],
    [
     0.0,
     0.0,
     0.0
    ]
   ],
   "vibration": [
    0.0,
    0.0
   ],
   "cumulative_cost": 0.0018,
   "probabilities": [
    [
     0.5,
     0.5
    ],
    [
     0.5,
     0.5
    ]
   ],
   "virtual_z": [
    3.141593,
    0.0
   ],
   "inactivity": [
    0,
    2
   ],
   "fidelities": [
    99.460204,
    99.480101
   ]
  },
  {
   "step": 5,
   "operation": "gpi2",
   "targets": [
    0
   ],
   "phases": [
    3.141593
   ],
   "cumulative_fidelity": 98.91343,
   "states": [
    [
     0.0,
     0.0,
     0.0
    ],
    [
     0.0,
     0.0,
     0.0
    ]
   ],
   "vibration": [
    0.0,
    0.0
   ],
   "cumulative_cost": 0.0021,
   "probabilities": [
    [
     0.5,
     0.5
    ],
    [
     0.5,
     0.5
    ]
   ],
   "virtual_z": [
    3.141593,
    0.0
   ],
   "inactivity": [
    0,
    3
   ],
   "fidelities": [
    99.440312,
    99.470153
   ]
  },
  {
   "step": 6,
   "operation": "gpi2",
   "targets": [
    1
   ],
   "phases": [
    3.141593
   ],
   "cumulative_fidelity": 98.883758,
   "states": [
    [
     0.0,
     0.0,
     0.0
    ],
    [
     0.0,
     0.0,
     0.0
    ]
   ],
   "vibration": [
    0.0,
    0.0
   ],
   "cumulative_cost": 0.0024,
   "probabilities": [
    [
     0.5,
     0.5
    ],
    [
     0.5,
     0.5
    ]
   ],
   "virtual_z": [
    3.141593,
    0.0
   ],
   "inactivity": [
    1,
    3
   ],
   "fidelities": [
    99.430368,
    99.450259
   ]
  },
  {
   "step": 7,
   "operation": "gpi2",
   "targets": [
    0
   ],
   "phases": [
    -1.570796
   ],
   "cumulative_fidelity": 98.854095,
   "states": [
    [
     0.0,
     0.0,
     0.0
    ],
    [
     0.0,
     0.0,
     0.0
    ]
   ],
   "vibration": [
    0.0,
    0.0
   ],
   "cumulative_cost": 0.0027,
   "probabilities": [
    [
     0.5,
     0.5
    ],
    [
     0.5,
     0.5
    ]
   ],
   "virtual_z": [
    3.141593,
    0.0
   ],
   "inactivity": [
    1,
    4
   ],
   "fidelities": [
    99.410482,
    99.440314
   ]
  }
 ]
}
